<?xml version="1.0" encoding="UTF-8"?>

<!ELEMENT stage-notes (start-note,note+,end-note)>
<!ELEMENT start-note (start,note)>
<!ELEMENT start (#PCDATA)>
<!ELEMENT note (turn-note|distance-note|warning-note)>
<!ELEMENT turn-note (modifier?,severity,direction,modifier*)>

<!-- a reason for "modifier" appearing twice? I believe that the "?" and the "*" both mean zero or more so you may not need both -->

<!ELEMENT modifier (#PCDATA)>
<!ELEMENT severity (#PCDATA)>
<!ELEMENT direction (#PCDATA)>
<!ELEMENT distance-note (distance,modifier?)>
<!ELEMENT distance (#PCDATA)>
<!ELEMENT warning-note (#PCDATA)>
<!ELEMENT end-note (finish,note+,stop)>
<!ELEMENT finish (#PCDATA)>
<!ELEMENT stop (#PCDATA)>
